D111210000281,11,2,Saitama Prefectural Toyooka High School,"1-15-1 Toyooka, Iruma City, Saitama Prefecture"
D111210000290,11,2,Saitama Prefectural Hanyu Jitsugyo High School,"323 Oaza Hanyu, Hanyu City, Saitama Prefecture"
D111210000307,11,2,Saitama Prefectural Matsuyama Girls' High School,"2-22 Izumicho, Higashimatsuyama City, Saitama Prefecture"
D111210000316,11,2,Saitama Prefectural Konosu High School,"1020 Oma, Konosu City, Saitama Prefecture"
D111210000325,11,2,Saitama Prefectural Fukaya Daiichi High School,"21-1 Tokiwacho, Fukaya City, Saitama Prefecture"
D111210000334,11,2,Saitama Prefectural Omiya High School,"2-323 Amanuma-cho, Omiya-ku, Saitama-shi, Saitama Prefecture"
D111210000343,11,2,Saitama Prefectural Kawaguchi High School,"963 Araijuku Suwayama, Kawaguchi City, Saitama Prefecture"
D111210000352,11,2,Saitama Prefectural Iwatsuki Commercial High School,"1-4-1 Ota, Iwatsuki-ku, Saitama City, Saitama Prefecture"
D111210000361,11,2,Saitama Prefectural Tokorozawa High School,"1234 Kume, Tokorozawa City, Saitama Prefecture"
D111210000370,11,2,Saitama Prefectural Ogano High School,"962-1 Ogano, Ogano-cho, Chichibu-gun, Saitama Prefecture"
D111210000389,11,2,Saitama Prefectural Yono High School,"2-8-1 Honmachi Nishi, Chuo-ku, Saitama City, Saitama Prefecture"
D111210000398,11,2,Saitama Prefectural Urawa Commercial High School,"2-19-39 Shirahata, Minami-ku, Saitama City, Saitama Prefecture"
D111210000405,11,2,Saitama Prefectural Omiya Commercial High School,"1-356 Owada-cho, Minuma-ku, Saitama City, Saitama Prefecture"
D111210000414,11,2,Saitama Prefectural Kumagaya Commercial High School,"800 Hirose, Kumagaya City, Saitama Prefecture"
D111210000423,11,2,Saitama Prefectural Kumagaya Technical High School,"820 Kojima, Kumagaya City, Saitama Prefecture"
D111210000432,11,2,Saitama Prefectural Warabi High School,"5-3-8 Kitamachi, Warabi City, Saitama Prefecture"
D111210000441,11,2,Saitama Prefectural Ageo High School,"1-6-1 Asamadai, Ageo City, Saitama Prefecture"
D111210000450,11,2,Saitama Prefectural Urawa Technical High School,"5-1-1 Nishibori, Sakura-ku, Saitama City, Saitama Prefecture"
D111210000469,11,2,Saitama Prefectural Soka High School,"5-3-1 Aoyagi, Soka City, Saitama Prefecture"
D111210000478,11,2,Saitama Prefectural Izumi High School,"7-4-1 Ennami, Chuo-ku, Saitama City, Saitama Prefecture"
D111210000487,11,2,Saitama Prefectural Sayama Technical High School,"2-5-1 Fujimi, Sayama City, Saitama Prefecture"
D111210000496,11,2,Saitama Prefectural Yorii Johoku High School,"2601 Sakurazawa, Yorii-cho, Osato-gun, Saitama Prefecture"
D111210000502,11,2,Saitama Prefectural Omiya Technical High School,"1970 Hongo-cho, Kita-ku, Saitama City, Saitama Prefecture"
D111210000511,11,2,Saitama Prefectural Asaka High School,"3-13-65 Saiwaicho, Asaka City, Saitama Prefecture"
D111210000520,11,2,Saitama Prefectural Kuki Technical High School,"474 Nokuki, Kuki City, Saitama Prefecture"
D111210000539,11,2,Saitama Prefectural Toda Shoyo High School,"1093-1 Niiso, Toda City, Saitama Prefecture"
D111210000548,11,2,Saitama Prefectural Kasukabe Technical High School,"1-1-1 Umeda Honmachi, Kasukabe City, Saitama Prefecture"
D111210000557,11,2,Saitama Prefectural Sayama Ryokuyo High School,"4-3-1 Hirose Higashi, Sayama City, Saitama Prefecture"
D111210000566,11,2,Saitama Prefectural Konosu Girls' High School,"1-1-72 Tenjin, Konosu City, Saitama Prefecture"
D111210000575,11,2,Saitama Prefectural Iwatsuki High School,"1-3-38 Jonan, Iwatsuki-ku, Saitama City, Saitama Prefecture"
D111210000584,11,2,Saitama Prefectural Minano High School,"19-1 Obuchi, Minano-machi, Chichibu-gun, Saitama Prefecture"
D111210000593,11,2,Saitama Prefectural Koshigaya Kita High School,"500-1 Odomari, Koshigaya City, Saitama Prefecture"
D111210000600,11,2,Saitama Prefectural Tokorozawa Commercial High School,"2-88 Hayashi, Tokorozawa City, Saitama Prefecture"
D111210000619,11,2,Saitama Prefectural Seiwa Welfare High School,"706 Kobe, Hanyu City, Saitama Prefecture"
D111210000628,11,2,Saitama Prefectural Tokiwa High School,"519-1 Kamiokubo, Sakura-ku, Saitama City, Saitama Prefecture"
D111210000637,11,2,Saitama Prefectural Sakado High School,"586 Kamiyoshida, Sakado City, Saitama Prefecture"
D111210000646,11,2,Saitama Prefectural Yoshikawa Minami High School,"600 Takaku, Yoshikawa City, Saitama Prefecture"
D111210000655,11,2,Saitama Prefectural Wako High School,"3-22-1 Arakura, Wako City, Saitama Prefecture"
D111210000664,11,2,Saitama Prefectural Okegawa High School,"945 Sakata, Okegawa City, Saitama Prefecture"
D111210000673,11,2,Saitama Prefectural Ogose High School,"600 Nishiwada, Ogose-cho, Iruma-gun, Saitama Prefecture"
D111210000691,11,2,Saitama Prefectural Niiza High School,"1-1-2 Ikeda, Niiza City, Saitama Prefecture"
D111210000708,11,2,Saitama Prefectural Fujimino High School,"1158-1 Oi, Fujimino City, Saitama Prefecture"
D111210000717,11,2,Saitama Prefectural Yashio High School,"650 Tsurugasone, Yashio City, Saitama Prefecture"
D111210000726,11,2,Saitama Prefectural Hasuda Shun High School,"4088 Kurohama, Hasuda City, Saitama Prefecture"
D111210000735,11,2,Saitama Prefectural Kawaguchikita High School,"1477 Kisoro, Kawaguchi City, Saitama Prefecture"
D111210000744,11,2,Saitama Prefectural Shiki High School,"1-1-1 Kamimuneoka, Shiki City, Saitama Prefecture"
D111210000753,11,2,Saitama Prefectural Tokorozawakita High School,"5-4 Namiki, Tokorozawa City, Saitama Prefecture"
D111210000762,11,2,Saitama Prefectural Hidaka High School,"806 Asahigaoka, Hidaka City, Saitama Prefecture"
D111210000771,11,2,Saitama Prefectural Fukaya High School,"315 Shukune, Fukaya City, Saitama Prefecture"
D111210000780,11,2,Saitama Prefectural Koshigaya Minami High School,"7-9 Lake Town, Koshigaya City, Saitama Prefecture"
D111210000799,11,2,Saitama Prefectural Kitamoto High School,"1-152 Furuichiba, Kitamoto City, Saitama Prefecture"
D111210000806,11,2,Saitama Prefectural Kawagoe Minami High School,"1-21-1 Minamiotsuka, Kawagoe City, Saitama Prefecture"
D111210000815,11,2,Saitama Prefectural Kumagaya Nishi High School,"2066 Mikajiri, Kumagaya City, Saitama Prefecture"
D111210000824,11,2,Saitama Prefectural Misato High School,"620-1 Hanawada, Misato City, Saitama Prefecture"
D111210000833,11,2,Saitama Prefectural Kurihashi Kitasai High School,"2-16 Isaka Minami, Kuki City, Saitama Prefecture"
D111210000842,11,2,Saitama Prefectural Soka Minami High School,"66 Yanagishimacho, Soka City, Saitama Prefecture"
D111210000851,11,2,Saitama Prefectural Omiya Musashino High School,"1601 Nishiyuma, Nishi-ku, Saitama City, Saitama Prefecture"
D111210000860,11,2,Saitama Prefectural Fujimi High School,"950 Kaminanhata, Fujimi City, Saitama Prefecture"
D111210000879,11,2,Saitama Prefectural Namekawa Sogo High School,"4-18-26 Tsukinowa, Namekawa-cho, Hiki-gun, Saitama Prefecture"
D111210000888,11,2,Saitama Prefectural Hanyu Daiichi High School,"153 Shimoiwase, Hanyu City, Saitama Prefecture"
D111210000897,11,2,Saitama Prefectural Ageo Minami High School,"585 Nakarai, Ageo City, Saitama Prefecture"
D111210000904,11,2,Saitama Prefectural Kasukabe Higashi High School,"363 Hikago, Kasukabe City, Saitama Prefecture"
D111210000913,11,2,Saitama Prefectural Shiraoka High School,"275-1 Takaiwa, Shiraoka City, Saitama Prefecture"
D111210000922,11,2,Saitama Prefectural Sugito High School,"1-1-36 Kiyochi, Sugito-cho, Kitakatsushika-gun, Saitama Prefecture"
D111210000931,11,2,Saitama Prefectural Kawaguchi Higashi High School,"3-1-1 Nagura, Kawaguchi, Saitama Prefecture"
D111210000940,11,2,Saitama Prefectural Urawa Kita High School,"595 Goseki, Sakura-ku, Saitama City, Saitama Prefecture"
D111210000968,11,2,Saitama Prefectural Washinomiya High School,"1020 Nakatsuma, Kuki City, Saitama Prefecture"
D111210000977,11,2,Saitama Prefectural Kamiotakanodai High School,"2800 Hara City, Ageo City, Saitama Prefecture"
D111210000986,11,2,Saitama Prefectural Asaka Nishi High School,"2-17 Hizaori, Asaka City, Saitama Prefecture"
D111210000995,11,2,Saitama Prefectural Niiza Yanase High School,"4-12-1 Owada, Niiza City, Saitama Prefecture"
D111210001002,11,2,Saitama Prefectural Kawagoe Nishi High School,"2488-1 Kasahata, Kawagoe City, Saitama Prefecture"
D111210001011,11,2,Saitama Prefectural Tokorozawa Nishi High School,"2-5-11 Kitano Shinmachi, Tokorozawa City, Saitama Prefecture"
D111210001020,11,2,Saitama Prefectural Sakado Nishi High School,"101 Yokkaichiba, Sakado City, Saitama Prefecture"
D111210001039,11,2,Saitama Prefectural Menuma High School,"480 Yatogo, Kumagaya City, Saitama Prefecture"
D111210001048,11,2,Saitama Prefectural Koshigaya Nishi High School,"460-1 Nojima, Koshigaya City, Saitama Prefecture"
D111210001057,11,2,Saitama Prefectural Omiya Higashi High School,"567 Hizuko, Minuma Ward, Saitama City, Saitama Prefecture"
D111210001066,11,2,Saitama Prefectural Minamiryo High School,"4-23-4 Bijogi, Toda City, Saitama Prefecture"
D111210001075,11,2,Saitama Prefectural Okegawanishi High School,"1531-2 Kawataya, Okegawa City, Saitama Prefecture"
D111210001084,11,2,Saitama Prefectural Fukiage Akizakura High School,"907-1 Maesuna, Konosu City, Saitama Prefecture"
D111210001093,11,2,Saitama Prefectural Tokorozawa Chuo High School,"8-2 Namiki, Tokorozawa City, Saitama Prefecture"
D111210001100,11,2,Saitama Prefectural Soka Higashi High School,"1110-1 Kakinokicho, Soka City, Saitama Prefecture"
D111210001119,11,2,Saitama Prefectural Misato Kita High School,"808 Ohiroto, Misato City, Saitama Prefecture"
D111210001128,11,2,Saitama Prefectural Showa High School,"583 Kanazaki, Kasukabe City, Saitama Prefecture"
D111210001137,11,2,Saitama Prefectural Matsubushi High School,"2-7-1 Yumeminohigashi, Matsubushi-cho, Kitakatsushika-gun, Saitama Prefecture"
D111210001146,11,2,Saitama Prefectural Iwatsuki Hokuryo High School,"117-2 Jionji, Iwatsuki Ward, Saitama City, Saitama Prefecture"
D111210001155,11,2,Saitama Prefectural Omiya Minami High School,"793 Uedayamoto, Nishi-ku, Saitama City, Saitama Prefecture"
D111210001164,11,2,Saitama Prefectural Sayama Seiryo High School,"34-3 Kamiokutomi, Sayama City, Saitama Prefecture"
D111210001173,11,2,Saitama Prefectural Tsurugashima Seifu High School,"946-1 Takakura, Tsurugashima City, Saitama Prefecture"
D111210001182,11,2,Saitama Prefectural Koshigaya Higashi High School,"5670-1 Masubayashi Arakawa Tsutsumigai, Koshigaya City, Saitama Prefecture"
D111210001191,11,2,Saitama Prefectural Miyashiro High School,"611 Higashi, Miyashiro-cho, Minamisaitama-gun, Saitama Prefecture"
D111210001208,11,2,Saitama Prefectural Urawa Higashi High School,"365 Terayama, Midori Ward, Saitama City, Saitama Prefecture"
D111210001217,11,2,Saitama Prefectural Ageo Tachibana High School,"2187-1 Hirata, Ageo City, Saitama Prefecture"
D111210001226,11,2,Saitama Prefectural Niiza Technical High School,"1-3-1 Niitsuka, Niiza City, Saitama Prefecture"
D111210001235,11,2,Saitama Prefectural Kawagoe Hatsugan High School,"2564 Sunashinda, Kawagoe City, Saitama Prefecture"
D111210001244,11,2,Saitama Prefectural Irumakoyo High School,"1-1-1 Koyodai, Iruma City, Saitama Prefecture"
D111210001253,11,2,Saitama Prefectural Hatoyama High School,"4-1-2 Matsugaoka, Hatoyama-cho, Hiki-gun, Saitama Prefecture"
D111210001262,11,2,Saitama Prefectural Soka Nishi High School,"2-7-1 Haramachi, Soka City, Saitama Prefecture"
D111210001271,11,2,Saitama Prefectural Kawaguchi Seiryo High School,"520-1 Kobe Higashi, Kawaguchi City, Saitama Prefecture"
D111210001280,11,2,Saitama Prefectural Ina Gakuen High School,"4-1-1 Gakuen, Ina-cho, Kitaadachi-gun, Saitama Prefecture"
D111210001299,11,2,Saitama Prefectural Arts High School,"2-695-1 Mikashima, Tokorozawa City, Saitama Prefecture"
D111210001306,11,2,Saitama Prefectural Yashio Minami High School,"519-1 Minamikawasaki Nedori, Yashio City, Saitama Prefecture"
D111210001315,11,2,Saitama Prefectural Misato Technical High School,"3-325 Hikonari, Misato City, Saitama Prefecture"
D111210001324,11,2,Saitama Prefectural Sayama Economics High School,"2-6-1 Inariyama, Sayama City, Saitama Prefecture"
D111210001333,11,2,Saitama Prefectural Omiya Koryo High School,"145 Nakanobayashi, Nishi-ku, Saitama City, Saitama Prefecture"
D111210001342,11,2,Saitama Prefectural Koshigaya Technical High School,"3-100-1 Yanakacho, Koshigaya City, Saitama Prefecture"
D111210001351,11,2,Saitama Prefectural Wako International High School,"4-1 Hirosawa, Wako City, Saitama Prefecture"
D111210001360,11,2,Saitama Prefectural Kukihokuyo High School,"837-1 Kukimoto, Kuki City, Saitama Prefecture"
D111210001379,11,2,Saitama Prefectural Hatogaya High School,"225-1 Sato, Kawaguchi City, Saitama Prefecture"
D111210001388,11,2,Saitama Prefectural Omiya Chuo High School,"2-499-1 Kushihiki-cho, Kita-ku, Saitama City, Saitama Prefecture"
D111210001397,11,2,Saitama Prefectural Hanyu High School,"303-1 Kabagasaki, Hanyu City, Saitama Prefecture"
D111220000011,11,2,Saitama City Urawa High School,"1-28-17 Motomachi, Urawa-ku, Saitama City, Saitama Prefecture"
D111220000020,11,2,Kawagoe City Kawagoe High School,"2-3-7 Asahicho, Kawagoe City, Saitama Prefecture"
D111220000039,11,2,Saitama City Omiya Kita High School,"91-1 Nara-cho, Kita-ku, Saitama City, Saitama Prefecture"
D111220000048,11,2,Saitama City Urawa Minami High School,"6-5-31 Tsuji, Minami-ku, Saitama City, Saitama Prefecture"
D111220000057,11,2,Kawaguchi City High School,"3-1-40 Kamiaoki, Kawaguchi City, Saitama Prefecture"
D111310100019,11,3,Saitama Sakae High School,"3-11-1 Nishiomiya, Nishi-ku, Saitama City, Saitama Prefecture"
D111310300017,11,3,Omiya Kaisei High School,"1-615 Horinouchi-cho, Omiya-ku, Saitama-shi, Saitama Prefecture"
D111310400016,11,3,Eito High School,"2-77 Sunamachi, Minuma-ku, Saitama City, Saitama Prefecture"
D111310500015,11,3,Shukutoku Yono High School,"5-19-18 Kamiochiai, Chuo-ku, Saitama City, Saitama Prefecture"
D111310700013,11,3,Urawa Reimei High School,"10-36 Higashigishi-cho, Urawa-ku, Saitama City, Saitama Prefecture"
D111310800012,11,3,Urawa Jitsugyo Gakuen High School,"3-9-1 Bunzo, Minami-ku, Saitama City, Saitama Prefecture"
D111310900011,11,3,Urawa Akinohoshi Girls' High School,"6-4-19 Higashiurawa, Midori-ku, Saitama City, Saitama Prefecture"
D111310900020,11,3,Urawa Gakuin High School,"172 Daiyama, Midori Ward, Saitama City, Saitama Prefecture"
D111310900039,11,3,Aoyama Gakuin University Affiliated Urawa Lutheran Gakuin High School,"3642 Osaki, Midori Ward, Saitama City, Saitama Prefecture"
D111311000018,11,3,Kaichi High School,"186 Tokuriki, Iwatsuki Ward, Saitama City, Saitama Prefecture"
D111320100018,11,3,Yamamura Gakuen High School,"16-2 Tamachi, Kawagoe City, Saitama Prefecture"
D111320100027,11,3,Toho Second High School Attached to Toho College of Music,"84 Imaizumi, Kawagoe City, Saitama Prefecture"
D111320100036,11,3,Hoshino High School,"3-9-1 Suehirocho, Kawagoe City, Saitama Prefecture"
D111320100045,11,3,Josai University Kawagoe High School,"1042 Yamada Higashimachi, Kawagoe City, Saitama Prefecture"
D111320100054,11,3,Hideaki High School,"4792 Kasahata, Kawagoe City, Saitama Prefecture"
D111320100063,11,3,Johoku Saitama High School,"585-1 Furuichiba, Kawagoe City, Saitama Prefecture"
D111320100072,11,3,Kawagoe Higashi High School,"6060 Kugedo, Kawagoe City, Saitama Prefecture"
D111320100081,11,3,Kasumigaseki High School,"2797-24 Matoba, Kawagoe City, Saitama Prefecture"
D111320900010,11,3,Seibou Gakuen High School,"292 Nakayama, Hanno City, Saitama Prefecture"
D111320900029,11,3,Jiyu no Mori Gakuen High School,"613 Koiwai, Hanno City, Saitama Prefecture"
D111320900038,11,3,Okawa Gakuen High School,"16-8 Nakamachi, Hanno City, Saitama Prefecture"
D111321000017,11,3,Hanasaki Tokuei High School,"519 Hanasaki, Kazo City, Saitama Prefecture"
D111321000026,11,3,Kaichi Mirai High School,"1238 Mugikura, Kazo City, Saitama Prefecture"
D111321100016,11,3,Honjo Daiichi High School,"1789 Nite, Honjo City, Saitama Prefecture"
D111321100025,11,3,Honjo Higashi High School,"1-4-5 Hinode, Honjo City, Saitama Prefecture"
D111321100034,11,3,Waseda University Honjo High School,"239-3 Kurisaki, Honjo City, Saitama Prefecture"
D111321200015,11,3,Tokyo University of Agriculture Third High School,"1400-1 Matsuyama, Higashimatsuyama City, Saitama Prefecture"
D111321400013,11,3,Kasukabe Kyoei High School,"213 Kamiomasu Shinden, Kasukabe City, Saitama Prefecture"
D111321400022,11,3,Shoei Gakuen High School,"2-40 Onuma, Kasukabe City, Saitama Prefecture"
D111321500012,11,3,Seibu Gakuen Bunri High School,"311-1 Kashihara Shinden, Sayama City, Saitama Prefecture"
D111321500021,11,3,Akikusa Gakuen High School,"2404 Horikane, Sayama City, Saitama Prefecture"
D111321800019,11,3,Masachi Fukaya High School,"369 Uenodai, Fukaya City, Saitama Prefecture"
D111321800028,11,3,Tokyo Seitoku University Fukaya High School,"559 Shukune, Fukaya City, Saitama Prefecture"
D111321800037,11,3,Sogakusha High School,"244-4 Chiaraijima, Fukaya City, Saitama Prefecture"
D111321900018,11,3,Hideaki Hidemitsu High School,"1012 Ueno, Ageo City, Saitama Prefecture"
D111322200013,11,3,Dokkyo Saitama High School,"316 Onma Nittajimae, Koshigaya City, Saitama Prefecture"
D111322200022,11,3,Musashino Seijo High School,"2-18-6 Shinkoshigaya, Koshigaya City, Saitama Prefecture"
D111322200040,11,3,Eimei High School,"7-2-1 Lake Town, Koshigaya City, Saitama Prefecture"
D111322300012,11,3,Wunan High School,"5-10-21 Tsukagoshi, Warabi City, Saitama Prefecture"
D111322500010,11,3,Sayamagaoka High School,"981 Shimofujisawa, Iruma City, Saitama Prefecture"
D111322500029,11,3,Musashino College of Music High School,"728 Nakagami, Iruma City, Saitama Prefecture"
D111322500038,11,3,Higashino High School,"112-1 Nihongi, Iruma City, Saitama Prefecture"
D111322800017,11,3,Hosoda Gakuen High School,"2-7-1 Honmachi, Shiki City, Saitama Prefecture"
D111322800026,11,3,Keio Shiki High School,"4-14-1 Honmachi, Shiki City, Saitama Prefecture"
D111323000013,11,3,Rikkyo Niiza High School,"1-2-25 Kitano, Niiza City, Saitama Prefecture"
D111323000022,11,3,Seibudai High School,"2-9-1 Nakano, Niiza City, Saitama Prefecture"
D111323900014,11,3,Yamamura International High School,"1-2-23 Chiyoda, Sakado City, Saitama Prefecture"
D111330100017,11,3,Kokusai Gakuin High School,"10474 Komuro, Ina-cho, Kitaadachi-gun, Saitama Prefecture"
D111330100026,11,3,Eihoku High School,"1123 Komuro, Ina-cho, Kitaadachi-gun, Saitama Prefecture"
D111332600018,11,3,Saitama Heisei High School,"333-1 Ichiba, Moroyama-cho, Iruma-gun, Saitama Prefecture"
D111332700017,11,3,Musashiogose High School,"1-3-10 Ueno Higashi, Ogose-cho, Iruma-gun, Saitama Prefecture"
D111332700026,11,3,Seiwa Gakuen High School,"1-3-2 Ueno Higashi, Ogose-cho, Iruma-gun, Saitama Prefecture"
D111334200018,11,3,Otsuma Arashiyama High School,"558 Sugaya, Arashiyama-cho, Hiki-gun, Saitama Prefecture"
D111346400010,11,3,Shohei High School,"851 Shimono, Sugito-cho, Kitakatsushika-gun, Saitama Prefecture"
D111346400029,11,3,Shigaku High School,"1643 Namizuka, Sugito-cho, Kitakatsushika-gun, Saitama Prefecture"
D112210000011,12,2,Chiba Prefectural Chiba High School,"1-5-2 Katsuragi, Chuo-ku, Chiba City, Chiba Prefecture"
D112210000020,12,2,Chiba Prefectural Chiba Girls' High School,"5-10-1 Konakadai, Inage-ku, Chiba City, Chiba Prefecture"
D112210000039,12,2,Chiba Prefectural Chiba Higashi High School,"1-18-52 Todoroki-cho, Inage-ku, Chiba City, Chiba Prefecture"
D112210000048,12,2,Chiba Prefectural Chiba Commercial High School,"2-22-48 Matsunami, Chuo-ku, Chiba City, Chiba Prefecture"
D112210000057,12,2,Chiba Prefectural Keiyo Technical High School,"4-11-32 Anagawa, Inage-ku, Chiba City, Chiba Prefecture"
D112210000066,12,2,Chiba Prefectural Chiba Technical High School,"1478 Imai-cho, Chuo-ku, Chiba City, Chiba Prefecture"
D112210000075,12,2,Chiba Prefectural Chiba Minami High School,"45-3 Hanawa-cho, Chuo-ku, Chiba City, Chiba Prefecture"
D112210000084,12,2,Chiba Prefectural Kemigawa High School,"4-17-1 Masago, Mihama-ku, Chiba City, Chiba Prefecture"
D112210000093,12,2,Chiba Prefectural Chiba Kita High School,"153 Naganuma-cho, Inage-ku, Chiba City, Chiba Prefecture"
D112210000100,12,2,Chiba Prefectural Wakamatsu High School,"429 Wakamatsu-cho, Wakaba-ku, Chiba City, Chiba Prefecture"
D112210000119,12,2,Chiba Prefectural Chijodai High School,"2-1-1 Chijodai Nishi, Wakaba Ward, Chiba City, Chiba Prefecture"
D112210000128,12,2,Chiba Prefectural Ikuhama High School,"372 Shioda-cho, Chuo-ku, Chiba City, Chiba Prefecture"
D112210000137,12,2,Chiba Prefectural Isobe High School,"2-7-1 Isobe, Mihama-ku, Chiba City, Chiba Prefecture"
D112210000146,12,2,Chiba Prefectural Izumi High School,"875-1 Takane-cho, Wakaba-ku, Chiba City, Chiba Prefecture"
D112210000155,12,2,Chiba Prefectural Kashiwai High School,"1452 Kashiwai-cho, Hanamigawa-ku, Chiba City, Chiba Prefecture"
D112210000164,12,2,Chiba Prefectural Chiba Omiya High School,"2699-1 Omiya-cho, Wakaba-ku, Chiba City, Chiba Prefecture"
D112210000173,12,2,Chiba Prefectural Toke High School,"2-24-1 Asumigaoka Higashi, Midori Ward, Chiba City, Chiba Prefecture"
D112210000182,12,2,Chiba Prefectural Chiba Nishi High School,"3-30-3 Isobe, Mihama-ku, Chiba City, Chiba Prefecture"
D112210000191,12,2,Chiba Prefectural Keihashi High School,"381-1 Chikusa-cho, Hanamigawa-ku, Chiba City, Chiba Prefecture"
D112210000208,12,2,Chiba Prefectural Makuhari Sogo High School,"3-1-6 Wakaba, Mihama-ku, Chiba City, Chiba Prefecture"
D112210000217,12,2,Chiba Prefectural Choshi High School,"943 Minami Ogawa-cho, Choshi City, Chiba Prefecture"
D112210000226,12,2,Chiba Prefectural Choshi Commercial High School,"1781 Daicho, Choshi City, Chiba Prefecture"
D112210000235,12,2,Chiba Prefectural Kokufudai High School,"2-4-1 Kokufudai, Ichikawa City, Chiba Prefecture"
D112210000244,12,2,Chiba Prefectural Kokubu High School,"2-2-1 Inagoe, Ichikawa City, Chiba Prefecture"
D112210000253,12,2,Chiba Prefectural Gyotoku High School,"4-1-1 Shiohama, Ichikawa City, Chiba Prefecture"
D112210000262,12,2,Chiba Prefectural Ichikawa Higashi High School,"4-2191 Kitakatacho, Ichikawa City, Chiba Prefecture"
D112210000271,12,2,Chiba Prefectural Ichikawaminami High School,"1509 Takaya, Ichikawa City, Chiba Prefecture"
D112210000280,12,2,Chiba Prefectural Ichikawa Technical High School,"3-10-10 Hirata, Ichikawa City, Chiba Prefecture"
D112210000299,12,2,Chiba Prefectural Funabashi High School,"6-1-1 Higashifunabashi, Funabashi City, Chiba Prefecture"
D112210000306,12,2,Chiba Prefectural Yakuendai High School,"5-34-1 Yakuendai, Funabashi City, Chiba Prefecture"
D112210000315,12,2,Chiba Prefectural Funabashi Higashi High School,"2-13-1 Shibayama, Funabashi City, Chiba Prefecture"
D112210000324,12,2,Chiba Prefectural Funabashi Shibayama High School,"7-39-1 Shibayama, Funabashi City, Chiba Prefecture"
D112210000333,12,2,Chiba Prefectural Funabashi Futawa High School,"1-3-1 Futawa Nishi, Funabashi City, Chiba Prefecture"
D112210000342,12,2,Chiba Prefectural Funabashi Kowagama High School,"586 Kowakamacho, Funabashi City, Chiba Prefecture"
D112210000351,12,2,Chiba Prefectural Funabashi Hoden High School,"4-1-1 Fujiwara, Funabashi City, Chiba Prefecture"
D112210000360,12,2,Chiba Prefectural Funabashi Totomi High School,"656-8 Toyotomicho, Funabashi City, Chiba Prefecture"
D112210000379,12,2,Chiba Prefectural Funabashi Kita High School,"133-1 Jimbocho, Funabashi City, Chiba Prefecture"
D112210000388,12,2,Chiba Prefectural Awa High School,"385 Yahata, Tateyama City, Chiba Prefecture"
D112210000397,12,2,Chiba Prefectural Tateyama Sogo High School,"106 Hojo, Tateyama City, Chiba Prefecture"
D112210000404,12,2,Chiba Prefectural Kisarazu High School,"4-1-1 Bunkyo, Kisarazu City, Chiba Prefecture"
D112210000413,12,2,Chiba Prefectural Kisarazu Higashi High School,"2-2-45 Kisarazu, Kisarazu City, Chiba Prefecture"
D112210000422,12,2,Chiba Prefectural Matsudo High School,"590-1 Nakawakura, Matsudo City, Chiba Prefecture"
D112210000431,12,2,Chiba Prefectural Kogane High School,"2-14-1 Shinmatsudo Kita, Matsudo City, Chiba Prefecture"
D112210000440,12,2,Chiba Prefectural Matsudo International High School,"5-6-1 Goko Nishi, Matsudo City, Chiba Prefecture"
D112210000459,12,2,Chiba Prefectural Matsudo Minami High School,"1199 Kamijiki, Matsudo City, Chiba Prefecture"
D112210000468,12,2,Chiba Prefectural Matsudo Rokumi High School,"5-150-1 Rokkodai, Matsudo City, Chiba Prefecture"
D112210000477,12,2,Chiba Prefectural Matsudo Mabashi High School,"1-7-1 Asahicho, Matsudo City, Chiba Prefecture"
D112210000486,12,2,Chiba Prefectural Shimizu High School,"482 Shimizu, Noda City, Chiba Prefecture"
D112210000495,12,2,Chiba Prefectural Noda Chuo High School,"713 Yatsu, Noda City, Chiba Prefecture"
D112210000501,12,2,Chiba Prefectural Sawara High School,"2685 Saharai, Katori City, Chiba Prefecture"
D112210000510,12,2,Chiba Prefectural Sawara Hakuyo High School,"861 Saharai, Katori City, Chiba Prefecture"
D112210000529,12,2,Chiba Prefectural Chosei High School,"286 Takashi, Mobara City, Chiba Prefecture"
D112210000538,12,2,Chiba Prefectural Mobara High School,"1300 Takashi, Mobara City, Chiba Prefecture"
D112210000547,12,2,Chiba Prefectural Mobara Shoyo High School,"283 Kambayashi, Mobara City, Chiba Prefecture"
D112210000556,12,2,Chiba Prefectural Narita Seiryo High School,"20 Matsuzaki, Narita City, Chiba Prefecture"
D112210000565,12,2,Chiba Prefectural Narita International High School,"3-16 Karabe, Narita City, Chiba Prefecture"
D112210000574,12,2,Chiba Prefectural Narita Kita High School,"5-1 Tamatsukuri, Narita City, Chiba Prefecture"
D112210000583,12,2,Chiba Prefectural Sakura High School,"18 Nabeyama-cho, Sakura City, Chiba Prefecture"
D112210000592,12,2,Chiba Prefectural Sakura Higashi High School,"278 Jonaicho, Sakura City, Chiba Prefecture"
D112210000609,12,2,Chiba Prefectural Sakura Nishi High School,"263 Shimoshizu, Sakura City, Chiba Prefecture"
D112210000618,12,2,Chiba Prefectural Sakura Minami High School,"1956 Ota, Sakura City, Chiba Prefecture"
