D131210000027,31,2,Tottori Prefectural Tottori Nishi High School,"2-112 Higashimachi, Tottori City, Tottori Prefecture"
D131210000036,31,2,Tottori Prefectural Tottori Commercial High School,"2-401 Kita, Koyamacho, Tottori City, Tottori Prefecture"
D131210000045,31,2,Tottori Prefectural Tottori Technical High School,"111 Ikuyama, Tottori City, Tottori Prefecture"
D131210000054,31,2,Tottori Prefectural Iwami High School,"708-2 Uradome, Iwami-cho, Iwami-gun, Tottori Prefecture"
D131210000063,31,2,Tottori Prefectural Yazu High School,"725 Kunoji, Yazu-cho, Yazu-gun, Tottori Prefecture"
D131210000072,31,2,Tottori Prefectural Chizu Agriculture and Forestry High School,"711-1 Chizu, Chizu-cho, Yazu-gun, Tottori Prefecture"
D131210000081,31,2,Tottori Prefectural Aoya High School,"2912 Aoya, Aoya-cho, Tottori City, Tottori Prefecture"
D131210000090,31,2,Tottori Prefectural Kurayoshi Higashi High School,"801 Shimodanakacho, Kurayoshi City, Tottori Prefecture"
D131210000107,31,2,Tottori Prefectural Kurayoshi Nishi High School,"20 Akiyoshi, Kurayoshi City, Tottori Prefecture"
D131210000116,31,2,Tottori Prefectural Kurayoshi Agricultural High School,"166 Otani, Kurayoshi City, Tottori Prefecture"
D131210000125,31,2,Tottori Prefectural Yonago Higashi High School,"1 Katsutacho, Yonago City, Tottori Prefecture"
D131210000134,31,2,Tottori Prefectural Yonago Nishi High School,"200 Otanicho, Yonago City, Tottori Prefecture"
D131210000143,31,2,Tottori Prefectural Yonago Minami High School,"216 Nagasunacho, Yonago, Tottori Prefecture"
D131210000152,31,2,Tottori Prefectural Yonago Technical High School,"4-220 Bakurocho, Yonago City, Tottori Prefecture"
D131210000161,31,2,Tottori Prefectural Yonago High School,"30-1 Hashimoto, Yonago City, Tottori Prefecture"
D131210000170,31,2,Tottori Prefectural Sakai High School,"3030 Kamimichicho, Sakaiminato City, Tottori Prefecture"
D131210000189,31,2,Tottori Prefectural Hino High School,"310 Neu, Hino-cho, Hino-gun, Tottori Prefecture"
D131210000198,31,2,Tottori Prefectural Tottori Koryo High School,"3-250 Kita, Koyamacho, Tottori City, Tottori Prefecture"
D131210000205,31,2,Tottori Prefectural Kurayoshi Industrial High School,"204-5 Oda, Kurayoshi City, Tottori Prefecture"
D131210000214,31,2,Tottori Prefectural Tottori Chuo Ikuei High School,"291-1 Yurashuku, Hokuei-cho, Tohaku-gun, Tottori Prefecture"
D131210000223,31,2,Tottori Prefectural Sakaiminato Technical High School,"925 Takeuchi-cho, Sakaiminato City, Tottori Prefecture"
D131210000232,31,2,Tottori Prefectural Tottori Ryokufu High School,"3-848 Minami Koyamacho, Tottori City, Tottori Prefecture"
D131210000241,31,2,Tottori Prefectural Yonago Hakuho High School,"24 Fukuoka, Yodoe-cho, Yonago-shi, Tottori Prefecture"
D131310000016,31,3,Tottori Keiai High School,"1-111 Nishimachi, Tottori City, Tottori Prefecture"
D131310000025,31,3,Tottori Johoku High School,"848 Nishishinaharu, Tottori City, Tottori Prefecture"
D131310000034,31,3,Kurayoshi Kita High School,"1-180 Fukuniwa-cho, Kurayoshi City, Tottori Prefecture"
D131310000043,31,3,Yonago Kita High School,"6-14-1 Maibara, Yonago City, Tottori Prefecture"
D131310000052,31,3,Yonago Shoin High School,"316-1 Nihongi, Yonago City, Tottori Prefecture"
D131310000061,31,3,Yonago Hokuto High School,"50 Yamicho, Yonago City, Tottori Prefecture"
D131310000070,31,3,Yurihama Gakuen High School,"32-1 Tabata, Yurihama-cho, Tohaku-gun, Tottori Prefecture"
D131310000089,31,3,Seisho Kaichi High School,"3-301-2 Shindori, Kokufucho, Tottori City, Tottori Prefecture"
D132220100033,32,2,Shimane Prefectural Matsue Kita High School,"164 Okutanicho, Matsue City, Shimane Prefecture"
D132220100042,32,2,Shimane Prefectural Matsue Minami High School,"1-1-1 Yakumodai, Matsue City, Shimane Prefecture"
D132220100051,32,2,Shimane Prefectural Matsue Higashi High School,"510 Nishikawazucho, Matsue City, Shimane Prefecture"
D132220100060,32,2,Shimane Prefectural Matsue Technical High School,"4-1-10 Koshihara, Matsue City, Shimane Prefecture"
D132220100079,32,2,Shimane Prefectural Matsue Commercial High School,"8-1-1 Hamanogi, Matsue City, Shimane Prefecture"
D132220100088,32,2,Shimane Prefectural Matsue Agriculture and Forestry High School,"51 Nogi Fukutomi-cho, Matsue City, Shimane Prefecture"
D132220100097,32,2,Shimane Prefectural Shinji High School,"1586 Shinji, Shinji-cho, Matsue City, Shimane Prefecture"
D132220100373,32,2,Matsue City Minamigaoka Girls' High School,"540-1 Nishiocho, Matsue City, Shimane Prefecture"
D132220200274,32,2,Shimane Prefectural Hamada High School,"3749 Kurokawacho, Hamada City, Shimane Prefecture"
D132220200283,32,2,Shimane Prefectural Hamada Commercial High School,"675 Atsutacho, Hamada City, Shimane Prefecture"
D132220200292,32,2,Shimane Prefectural Hamada Fisheries High School,"25-3 Setogashimacho, Hamada City, Shimane Prefecture"
D132220300157,32,2,Shimane Prefectural Hirata High School,"1 Hiratacho, Izumo City, Shimane Prefecture"
D132220300166,32,2,Shimane Prefectural Izumo High School,"1800 Imaichi-cho, Izumo City, Shimane Prefecture"
D132220300175,32,2,Shimane Prefectural Izumo Technical High School,"420 Kamishiojicho, Izumo City, Shimane Prefecture"
D132220300184,32,2,Shimane Prefectural Izumo Commercial High School,"2525 Otsucho, Izumo City, Shimane Prefecture"
D132220300193,32,2,Shimane Prefectural Izumo Agriculture and Forestry High School,"950 Shimoyokocho, Izumo City, Shimane Prefecture"
D132220300200,32,2,Shimane Prefectural Taisha High School,"1473 Kita-Araki, Taisha-cho, Izumo-shi, Shimane Prefecture"
D132220400307,32,2,Shimane Prefectural Masuda High School,"1-17 Nanaocho, Masuda City, Shimane Prefecture"
D132220400316,32,2,Shimane Prefectural Masuda Shoyo High School,"3-21-1 Takatsu, Masuda City, Shimane Prefecture"
D132220500217,32,2,Shimane Prefectural Ota High School,"568 Ota-i, Ota-cho, Ota-shi, Shimane Prefecture"
D132220500226,32,2,Shimane Prefectural Numa High School,"907 Nima, Nima-cho, Ota City, Shimane Prefecture"
D132220600010,32,2,Shimane Prefectural Yasugi High School,"115 Sakubocho, Yasugi City, Shimane Prefecture"
D132220600029,32,2,Shimane Prefectural Information Science High School,"310 Nogicho, Yasugi City, Shimane Prefecture"
D132220700251,32,2,Shimane Prefectural Gotsu High School,"293 Tsunotsu, Gotsu City, Shimane Prefecture"
D132220700260,32,2,Shimane Prefectural Gotsu Technical High School,"1477 Gotsu-cho, Gotsu City, Shimane Prefecture"
D132220900106,32,2,Shimane Prefectural Daito High School,"637 Daito, Daito-cho, Unnan-shi, Shimane Prefecture"
D132220900124,32,2,Shimane Prefectural Santoya High School,"912-2 Mitouya, Mitouya-cho, Unnan City, Shimane Prefecture"
D132234300112,32,2,Shimane Prefectural Yokota High School,"2178-1 Inabara, Okuizumo-cho, Nita-gun, Shimane Prefecture"
D132238600147,32,2,Shimane Prefectural Iinan High School,"800 Nogaya, Iinan-machi, Iishi-gun, Shimane Prefecture"
D132244100239,32,2,Shimane Prefectural Shimane Chuo High School,"222 Kawamoto, Kawamoto-cho, Ochi-gun, Shimane Prefecture"
D132244900240,32,2,Shimane Prefectural Yagami High School,"3921 Yagami, Onan-cho, Ochi-gun, Shimane Prefecture"
D132250100334,32,2,Shimane Prefectural Tsuwano High School,"12-3 Gotaha, Tsuwano-cho, Kaashi-gun, Shimane Prefecture"
D132250500321,32,2,Shimane Prefectural Yoshiga High School,"937 Nanukaichi, Yoshika-machi, Kazutari-gun, Shimane Prefecture"
D132252500354,32,2,Shimane Prefectural Okishimae High School,"1403 Oaza Fukui, Ama-cho, Oki-gun, Shimane Prefecture"
D132252800342,32,2,Shimane Prefectural Oki High School,"1 Arikiniterahara, Okinoshima-cho, Oki-gun, Shimane Prefecture"
D132252800360,32,2,Shimane Prefectural Oki Fisheries High School,"2 Togo Yoshizu, Okinoshima-cho, Oki-gun, Shimane Prefecture"
D132320100380,32,3,Kaisei High School,"9-11-1 Nishitsuda, Matsue City, Shimane Prefecture"
D132320100399,32,3,Rissho University Shonan High School,"1794-2 Obacho, Matsue City, Shimane Prefecture"
D132320100406,32,3,Shotoku Gakuin High School,"1-14-51 Kaminogi, Matsue City, Shimane Prefecture"
D132320100415,32,3,Matsue Nishi High School,"3-21-10 Kaminogi, Matsue City, Shimane Prefecture"
D132320300422,32,3,Izumo Hokuryo High School,"3 Nishibayashimachi, Izumo City, Shimane Prefecture"
D132320300431,32,3,Izumo Nishi High School,"1163 Shimokoshicho, Izumo City, Shimane Prefecture"
D132320400467,32,3,Meisei High School,"7-37 Miyakecho, Masuda City, Shimane Prefecture"
D132320400476,32,3,Masuda Higashi High School,"1-24 Somebacho, Masuda City, Shimane Prefecture"
D132320700446,32,3,Iwami Chisuikan High School,"1904-1 Watatsucho, Gotsu City, Shimane Prefecture"
D132320700455,32,3,Christian Aishin High School,"1826-1 Asari-cho, Gotsu City, Shimane Prefecture"
D133210000016,33,2,Okayama Prefectural Okayama Asahi High School,"2-2-21 Kokyo-cho, Naka-ku, Okayama City, Okayama Prefecture"
D133210000025,33,2,Okayama Prefectural Okayama Sozan High School,"412 Hama, Naka-ku, Okayama City, Okayama Prefecture"
D133210000034,33,2,Okayama Prefectural Okayama Technical High School,"4-3-92 Ifuku-cho, Kita-ku, Okayama City, Okayama Prefecture"
D133210000043,33,2,Okayama Prefectural Higashiokayama Technical High School,"290-1 Tsuchida, Naka-ku, Okayama City, Okayama Prefecture"
D133210000052,33,2,Okayama Prefectural Okayama Higashi Commercial High School,"3-1-6 Higashiyama, Naka-ku, Okayama City, Okayama Prefecture"
D133210000061,33,2,Okayama Prefectural Okayama Minami High School,"2-4-7 Okuda, Kita-ku, Okayama City, Okayama Prefecture"
D133210000070,33,2,Okayama Prefectural Kurashiki Seiryo High School,"1046-2 Hashima, Kurashiki City, Okayama Prefecture"
D133210000089,33,2,Okayama Prefectural Kurashiki Amagi High School,"269 ??Amagi, Fujito-cho, Kurashiki-shi, Okayama Prefecture"
D133210000098,33,2,Okayama Prefectural Kurashiki Chuo High School,"1384 Nishitomii, Kurashiki City, Okayama Prefecture"
D133210000105,33,2,Okayama Prefectural Kurashiki Technical High School,"4-9-1 Oimatsucho, Kurashiki City, Okayama Prefecture"
D133210000114,33,2,Okayama Prefectural Mizushima Technical High School,"1230 Nishiachicho, Kurashiki City, Okayama Prefecture"
D133210000123,33,2,Okayama Prefectural Kurashiki Commercial High School,"545 Hakurakucho, Kurashiki City, Okayama Prefecture"
D133210000132,33,2,Okayama Prefectural Tamashima High School,"3-1-1 Tamashima Agazaki, Kurashiki City, Okayama Prefecture"
D133210000141,33,2,Okayama Prefectural Tamashima Commercial High School,"2-9-30 Tamashimachuocho, Kurashiki City, Okayama Prefecture"
D133210000150,33,2,Okayama Prefectural Tsuyama High School,"62 Tsubakitakashita, Tsuyama City, Okayama Prefecture"
D133210000169,33,2,Okayama Prefectural Tsuyama Technical High School,"411-1 Yamakita, Tsuyama City, Okayama Prefecture"
D133210000178,33,2,Okayama Prefectural Tsuyama Commercial High School,"531 Yamakita, Tsuyama City, Okayama Prefecture"
D133210000187,33,2,Okayama Prefectural Tsuyama Higashi High School,"1200 Hayashida, Tsuyama City, Okayama Prefecture"
D133210000196,33,2,Okayama Prefectural Tamano High School,"3-11-1 Chikko, Tamano City, Okayama Prefecture"
D133210000203,33,2,Okayama Prefectural Kasaoka High School,"3073-2 Kasaoka, Kasaoka City, Okayama Prefecture"
D133210000212,33,2,Okayama Prefectural Kasaoka Technical High School,"808 Yokoshima, Kasaoka City, Okayama Prefecture"
D133210000221,33,2,Okayama Prefectural Kasaoka Commercial High School,"3203 Kasaoka, Kasaoka City, Okayama Prefecture"
D133210000230,33,2,Okayama Prefectural Saidaiji High School,"2-1-17 Saidaijikami, Higashi Ward, Okayama City, Okayama Prefecture"
D133210000249,33,2,Okayama Prefectural Ibara High School,"1802 Ibaramachi, Ibara City, Okayama Prefecture"
D133210000258,33,2,Okayama Prefectural Soja High School,"3-9-1 Soja, Soja City, Okayama Prefecture"
D133210000267,33,2,Okayama Prefectural Takahashi High School,"38 Yamashita, Takahashi City, Okayama Prefecture"
D133210000276,33,2,Okayama Prefectural Niimi High School,"1394 Niimi, Niimi City, Okayama Prefecture"
D133210000285,33,2,Okayama Prefectural Seto High School,"316-1 Komeidani, Seto-cho, Higashi-ku, Okayama City, Okayama Prefecture"
D133210000294,33,2,Okayama Prefectural Seto Minami High School,"88 Oki, Seto-cho, Higashi-ku, Okayama City, Okayama Prefecture"
D133210000301,33,2,Okayama Prefectural Wake Shibuya High School,"15 Shakusho, Wake Town, Wake District, Okayama Prefecture"
D133210000310,33,2,Okayama Prefectural Oku High School,"404 Owari, Oku-cho, Setouchi City, Okayama Prefecture"
D133210000329,33,2,Okayama Prefectural Koyo High School,"1500 Fujita, Minami-ku, Okayama City, Okayama Prefecture"
D133210000338,33,2,Okayama Prefectural Kamogata High School,"819 Kamogata, Kamogata-cho, Asakuchi City, Okayama Prefecture"
D133210000347,33,2,Okayama Prefectural Yakage High School,"1776-2 Yakage, Yakage-cho, Oda-gun, Okayama Prefecture"
D133210000356,33,2,Okayama Prefectural Takamatsu Agricultural High School,"336-2 Takamatsubara Kosai, Kita-ku, Okayama City, Okayama Prefecture"
D133210000365,33,2,Okayama Prefectural Katsuyama High School,"481 Katsuyama, Maniwa City, Okayama Prefecture"
D133210000374,33,2,Okayama Prefectural Katsumada High School,"47 Katsumada, Katsao-machi, Katsuta-gun, Okayama Prefecture"
D133210000383,33,2,Okayama Prefectural Hayashino High School,"58-1 Mikurata, Mimasaka City, Okayama Prefecture"
D133210000392,33,2,Okayama Prefectural Okayama Hosen High School,"3-1-1 Hosen, Minami-ku, Okayama City, Okayama Prefecture"
D133210000409,33,2,Okayama Prefectural Kurashiki Minami High School,"330 Yoshioka, Kurashiki City, Okayama Prefecture"
D133210000418,33,2,Okayama Prefectural Okayama Ichinomiya High School,"221 Naratzu, Kita-ku, Okayama City, Okayama Prefecture"
D133210000427,33,2,Okayama Prefectural Kurashiki Kojoike High School,"116-1 Koshinden, Fukuda-cho, Kurashiki-shi, Okayama Prefecture"
D133210000436,33,2,Okayama Prefectural Tamano Konan High School,"244 Higashishichi Ward, Tamano City, Okayama Prefecture"
D133210000445,33,2,Okayama Prefectural Soja Minami High School,"626-1 Miwa, Soja City, Okayama Prefecture"
D133210000454,33,2,Okayama Prefectural Okayama Joto High School,"110 Shimo, Naka-ku, Okayama City, Okayama Prefecture"
D133210000463,33,2,Okayama Prefectural Bizen Ryokuyo High School,"91-1 Nishikatakami, Bizen City, Okayama Prefecture"
D133210000472,33,2,Okayama Prefectural Takahashi Jonan High School,"1216-1 Harada Kita-cho, Takahashi City, Okayama Prefecture"
D133210000481,33,2,Okayama Prefectural Maniwa High School,"448-1 Tarumi Ochiai, Maniwa City, Okayama Prefecture"
D133210000490,33,2,Tamano City Tamano Commercial High School,"6-1-1 Tamano, Tamano City, Okayama Prefecture"
D133210000506,33,2,Okayama Prefectural Okayama Mitsu High School,"940 Mitsukanagawa, Kita-ku, Okayama City, Okayama Prefecture"
D133210000515,33,2,Okayama Prefectural Kurashiki Washu High School,"2301 Kojima Ajino Yamadacho, Kurashiki City, Okayama Prefecture"
D133210000524,33,2,Okayama Prefectural Karasujo High School,"3-1-1 Ijima-cho, Kita-ku, Okayama City, Okayama Prefecture"
D133210000533,33,2,Kurashiki City Seishi High School,"199-3 Hachioji-cho, Kurashiki City, Okayama Prefecture"
D133210000542,33,2,Kurashiki City Technical High School,"716-1 Tanoue, Kurashiki City, Okayama Prefecture"
D133210000551,33,2,Kurashiki City Tamashima High School,"1-15-60 Tamashima, Kurashiki City, Okayama Prefecture"
D133210000560,33,2,Tamano City Tamano Binan High School,"4-7-1 Wada, Tamano City, Okayama Prefecture"
D133210000579,33,2,Ibara City High School,"1151 Ibaramachi, Ibara City, Okayama Prefecture"
D133210000588,33,2,Takahashi City Uji High School,"1681-2 Uji, Uji-cho, Takahashi City, Okayama Prefecture"
D133210000597,33,2,Bizen City Katakami High School,"91-1 Nishikatakami, Bizen City, Okayama Prefecture"
D133210000604,33,2,Takahashi City Matsuyama High School,"1216-1 Harada Kita-cho, Takahashi City, Okayama Prefecture"
D133210000613,33,2,Kurashiki City Mabiryo Minami High School,"1769-1 Yamuda, Mabi-cho, Kurashiki-shi, Okayama Prefecture"
D133210000622,33,2,Okayama City Okayama Korakukan High School,"1-3-15 Minamikata, Kita-ku, Okayama City, Okayama Prefecture"
D133210000631,33,2,Kurashiki City Kurashiki Shonan High School,"160 Kojima Hiedacho, Kurashiki City, Okayama Prefecture"
D133310000014,33,3,Kansai High School,"16-1 Nishizakihonmachi, Kita-ku, Okayama City, Okayama Prefecture"
D133310000023,33,3,Okayama University of Commerce High School,"5-2-45 Minamikata, Kita-ku, Okayama City, Okayama Prefecture"
D133310000032,33,3,Sanyo Gakuen High School,"2-2-16 Kadotayashiki, Naka-ku, Okayama City, Okayama Prefecture"
D133310000041,33,3,Shuji High School,"14-23 Yuminocho, Kita-ku, Okayama City, Okayama Prefecture"
D133310000050,33,3,Soushi Gakuen High School,"7-38 Shimoifuku Nishicho, Kita Ward, Okayama City, Okayama Prefecture"
D133310000069,33,3,Meisei Gakuin High School,"3-5-1 Tsushima Nishizaka, Kita-ku, Okayama City, Okayama Prefecture"
D133310000078,33,3,Kurashiki High School,"283 Toba, Kurashiki City, Okayama Prefecture"
D133310000087,33,3,Okayama University of Science High School,"1-1 Ridai-cho, Kita-ku, Okayama City, Okayama Prefecture"
D133310000096,33,3,Kurashiki Suimatsu High School,"155 Hirata, Kurashiki City, Okayama Prefecture"
D133310000103,33,3,Okayama Prefecture Mimasaka High School,"500 Yamakita, Tsuyama City, Okayama Prefecture"
D133310000112,33,3,Sakuyo Gakuen High School,"1541-1 Tamashima Yashima, Kurashiki City, Okayama Prefecture"
D133310000121,33,3,Okayama Ryukoku High School,"874 Kasaoka, Kasaoka City, Okayama Prefecture"
D133310000130,33,3,Okayama Gakugeikan High School,"1-19-19 Saidaijikami, Higashi Ward, Okayama City, Okayama Prefecture"
D133310000149,33,3,Kojokan High School,"2257-1 Nishiebaramachi, Ibara City, Okayama Prefecture"
D133310000158,33,3,Hoya Gakusha High School,"150 Yamashita, Takahashi City, Okayama Prefecture"
D133310000167,33,3,Seishin Girls' High School,"1200 Futago, Kurashiki City, Okayama Prefecture"
D133310000176,33,3,Okayama Sanyo High School,"2069 Rokujoinaka, Kamogata-cho, Asakuchi-shi, Okayama Prefecture"
D133310000185,33,3,Konko Gakuen High School,"1350 Uramishinden, Konko-cho, Asakuchi-shi, Okayama Prefecture"
D133310000194,33,3,Kawasaki Medical University High School,"1661 Ikusaka, Kurashiki City, Okayama Prefecture"
D133310000201,33,3,Okayama Prefecture Kyosei High School,"2032-4 Niimi, Niimi City, Okayama Prefecture"
D133310000210,33,3,Okayama Hakuryo High School,"Akaiwa City, Okayama Prefecture Force 588"
D133310000229,33,3,Okayama High School,"1500 Minoshima, Minami Ward, Okayama City, Okayama Prefecture"
D133310000238,33,3,Kibi Kogen Gakuen High School,"2400 Ueno, Kibichuo-cho, Kaga-gun, Okayama Prefecture"
D133310000247,33,3,Kashima Asahi High School,"2590 Mitsu Shiko, Kita Ward, Okayama City, Okayama Prefecture"
D133310000256,33,3,Jikei Gakuen High School,"1665 Furumachi, Mimasaka City, Okayama Prefecture"
D134110000017,34,1,Hiroshima University High School,"1-1-1 Midori, Minami-ku, Hiroshima City, Hiroshima Prefecture"
D134110000026,34,1,Hiroshima University Fukuyama High School,"5-14-1 Kasugacho, Fukuyama City, Hiroshima Prefecture"
D134210000015,34,2,Hiroshima Prefectural Hiroshima Minami High School,"2-4-76 Idashio, Minami-ku, Hiroshima City, Hiroshima Prefecture"
D134210000024,34,2,Hiroshima Prefectural Hiroshima Kokutaiji High School,"1-2-49 Kokutaiji-cho, Naka-ku, Hiroshima City, Hiroshima Prefecture"
D134210000033,34,2,Hiroshima Prefectural Hiroshima Kannon High School,"4-10 Minamikannon-cho, Nishi-ku, Hiroshima City, Hiroshima Prefecture"
D134210000042,34,2,Hiroshima Prefectural Koyo High School,"3-22-1 Makame, Asakita Ward, Hiroshima City, Hiroshima Prefecture"
D134210000051,34,2,Hiroshima Prefectural Aki Minami High School,"2-15-1 Yanonishi, Aki-ku, Hiroshima City, Hiroshima Prefecture"
D134210000060,34,2,Hiroshima Prefectural Hiro High School,"3-6-44 Hirodai Shinkai, Kure City, Hiroshima Prefecture"
D134210000079,34,2,Hiroshima Prefectural Kure Miyahara High School,"3-1-1 Miyahara, Kure City, Hiroshima Prefecture"
D134210000088,34,2,Hiroshima Prefectural Kure Mitsuda High School,"1-5-1 Yamate, Kure City, Hiroshima Prefecture"
D134210000104,34,2,Hiroshima Prefectural Mihara High School,"4-11-1 Miyaoki, Mihara City, Hiroshima Prefecture"
D134210000113,34,2,Hiroshima Prefectural Mihara Higashi High School,"2-7-1 Nakanocho, Mihara City, Hiroshima Prefecture"
D134210000122,34,2,Hiroshima Prefectural Onomichi Higashi High School,"12-1 Higashikubocho, Onomichi City, Hiroshima Prefecture"
D134210000131,34,2,Hiroshima Prefectural Onomichi Kita High School,"3-7-1 Nagae, Onomichi, Hiroshima Prefecture"
D134210000140,34,2,Hiroshima Prefectural Fukuyama Seinokan High School,"6-11-1 Kinoshocho, Fukuyama City, Hiroshima Prefecture"
D134210000159,34,2,Hiroshima Prefectural Fukuyama Ashiyo High School,"3-1-1 Hisamatsudai, Fukuyama City, Hiroshima Prefecture"
D134210000168,34,2,Hiroshima Prefectural Kaita High School,"1-60 Tsukumo-cho, Kaita-cho, Aki-gun, Hiroshima Prefecture"
D134210000177,34,2,Hiroshima Prefectural Kumano High School,"5-9-1 Kawakaku, Kumano-machi, Aki-gun, Hiroshima Prefecture"
D134210000186,34,2,Hiroshima Prefectural Ondo High School,"1-1-1 Kitakindo, Ondo-cho, Kure City, Hiroshima Prefecture"
D134210000195,34,2,Hiroshima Prefectural Akifu Junior and Senior High School,"5-1-1 Yamada, Fuchu-cho, Aki-gun, Hiroshima Prefecture"
D134210000202,34,2,Hiroshima Prefectural Hatsukaichi High School,"3-3-1 Sakurao, Hatsukaichi City, Hiroshima Prefecture"
D134210000211,34,2,Hiroshima Prefectural Hatsukaichi Nishi High School,"6-1 Ajindai Nishi, Hatsukaichi City, Hiroshima Prefecture"
D134210000220,34,2,Hiroshima Prefectural Yukiminami High School,"1198 Fushiya, Yuki-cho, Saeki-ku, Hiroshima-shi, Hiroshima Prefecture"
D134210000239,34,2,Hiroshima Prefectural Otake High School,"1-3-1 Shiroishi, Otake City, Hiroshima Prefecture"
D134210000248,34,2,Hiroshima Prefectural Saeki High School,"850 Tsuda, Hatsukaichi City, Hiroshima Prefecture"
D134210000257,34,2,Hiroshima Prefectural Ogaki High School,"1118-1 Ohara, Ogaki-cho, Etajima City, Hiroshima Prefecture"
D134210000266,34,2,Hiroshima Prefectural Kabe High School,"4-27-1 Kabe Higashi, Asakita Ward, Hiroshima City, Hiroshima Prefecture"
D134210000275,34,2,Hiroshima Prefectural Kake High School,"3780-1 Kake, Akiota-cho, Yamagata-gun, Hiroshima Prefecture"
D134210000293,34,2,Hiroshima Prefectural Chiyoda High School,"600-1 Arima, Kitahiroshima-cho, Yamagata-gun, Hiroshima Prefecture"
D134210000300,34,2,Hiroshima Prefectural Yoshida High School,"719-3 Yoshida, Yoshida-cho, Akitakada City, Hiroshima Prefecture"
D134210000319,34,2,Hiroshima Prefectural Mukaihara High School,"10006-1 Sakamaruyama, Mukaihara-cho, Akitakada City, Hiroshima Prefecture"
D134210000328,34,2,Hiroshima Prefectural Kamo High School,"16-22 Saijo Nishihonmachi, Higashihiroshima City, Hiroshima Prefecture"
D134210000337,34,2,Hiroshima Prefectural Kurose High School,"10001 Nomio, Kurose-cho, Higashihiroshima City, Hiroshima Prefecture"
D134210000346,34,2,Hiroshima Prefectural Kamokita High School,"632 Nomi, Toyosakacho, Higashihiroshima City, Hiroshima Prefecture"
D134210000355,34,2,Hiroshima Prefectural Takehara High School,"3444-1 Takehara-cho, Takehara-shi, Hiroshima"
D134210000364,34,2,Hiroshima Prefectural Toyota High School,"1202-4 Komatsubara, Akitsu-cho, Higashihiroshima City, Hiroshima Prefecture"
D134210000373,34,2,Hiroshima Prefectural Tadami High School,"4-4-1 Tadanoumi Tokoura, Takehara City, Hiroshima Prefecture"
D134210000382,34,2,Hiroshima Prefectural Gocho High School,"204-2 Kami, Onomichi City, Hiroshima Prefecture"
D134210000391,34,2,Hiroshima Prefectural Innoshima High School,"5574 Shigei-cho, Innoshima, Onomichi City, Hiroshima Prefecture"
D134210000408,34,2,Hiroshima Prefectural Sera High School,"870 Hongo, Sera-cho, Sera-gun, Hiroshima Prefecture"
D134210000417,34,2,Hiroshima Prefectural Matsunaga High School,"10113 Kamimuracho, Fukuyama City, Hiroshima Prefecture"
D134210000426,34,2,Hiroshima Prefectural Shonan High School,"4 Shimoyama Minami, Numakuma-cho, Fukuyama City, Hiroshima Prefecture"
D134210000435,34,2,Hiroshima Prefectural Fuchu High School,"898 Deguchicho, Fuchu City, Hiroshima Prefecture"
D134210000444,34,2,Hiroshima Prefectural Yuki High School,"1965 Yukiotsu, Jinseki Kogen-cho, Jinseki-gun, Hiroshima Prefecture"
D134210000453,34,2,Hiroshima Prefectural Junior and Senior High School,"566 Shigemachi, Shimomachi, Fuchu City, Hiroshima Prefecture"
D134210000462,34,2,Hiroshima Prefectural Miyoshi High School,"155 Minamihatashikicho, Miyoshi City, Hiroshima Prefecture"
D134210000471,34,2,Hiroshima Prefectural Shobara Kakuchi High School,"515 Mikkaichicho, Shobara City, Hiroshima Prefecture"
D134210000480,34,2,Hiroshima Prefectural Tojo High School,"476-2 Kawanishi, Higashijocho, Shobara City, Hiroshima Prefecture"
D134210000499,34,2,Hiroshima Prefectural Setoda High School,"1110-2 Nago, Setoda-cho, Onomichi City, Hiroshima Prefecture"
D134210000505,34,2,Hiroshima Prefectural Saijo Shisui High School,"345 Saijo, Saijo-cho, Shobara-shi, Hiroshima Prefecture"
D134210000514,34,2,Hiroshima Prefectural Koyo Higashi High School,"8-12-1 Ochiai Minami, Asakita Ward, Hiroshima City, Hiroshima Prefecture"
D134210000523,34,2,Hiroshima Prefectural Nisshokan High School,"293-2 Kissa, Kisa-cho, Miyoshi City, Hiroshima Prefecture"
D134210000541,34,2,Hiroshima Prefectural Itsukaichi High School,"3-15-1 Kannondai, Saeki-ku, Hiroshima City, Hiroshima Prefecture"
D134210000550,34,2,Hiroshima Prefectural Kawachi High School,"10194-2 Shimokawachi, Kawachi-cho, Higashihiroshima City, Hiroshima Prefecture"
D134210000569,34,2,Hiroshima Prefectural Ako City High School,"3-3-1 Bishamondai, Asaminami-ku, Hiroshima City, Hiroshima Prefecture"
D134210000578,34,2,Hiroshima Prefectural Anzai High School,"2-52-1 Takatori Minami, Asaminami Ward, Hiroshima City, Hiroshima Prefecture"
